{
  "taskId": "FORGE-S07-T07",
  "feature_id": null,
  "sprintId": "FORGE-S07",
  "title": "Migrate all 16 meta-workflows to use store custodian instead of direct store writes",
  "status": "approved",
  "path": "forge/meta/workflows/",
  "estimate": "XL",
  "dependencies": [
    "FORGE-S07-T05",
    "FORGE-S07-T06"
  ],
  "pipeline": "default"
}
