{
  "taskId": "FORGE-S02-T10",
  "sprintId": "FORGE-S02",
  "title": "Release engineering — version bump to v0.6.0, migration entry, security scan",
  "status": "committed",
  "path": "forge/.claude-plugin/plugin.json",
  "estimate": "S",
  "dependencies": [
    "FORGE-S02-T01",
    "FORGE-S02-T02",
    "FORGE-S02-T03",
    "FORGE-S02-T04",
    "FORGE-S02-T05",
    "FORGE-S02-T06",
    "FORGE-S02-T07",
    "FORGE-S02-T08",
    "FORGE-S02-T09"
  ],
  "pipeline": "default"
}
